date,time,headline,datetime
Apr-26-24,06:17PM,"A Big Week For The Stock Market: Apple, Amazon, Big Pharma And The Fed",2024-04-26 18:17:00
Apr-26-24,04:57PM,Why Amazon Stock Was Moving Higher Today,2024-04-26 16:57:00
Apr-26-24,04:53PM,"Fed decision, Big Tech earnings: What to watch",2024-04-26 16:53:00
Apr-26-24,04:40PM,"20 Countries with the Highest Share of Youth Not in Education, Employment or Training (NEET)",2024-04-26 16:40:00
Apr-26-24,04:01PM,Forget Nvidia And Google. Only One AI Stock Pulled This Off.,2024-04-26 16:01:00
Apr-26-24,03:56PM,FTC deepens Amazon antitrust probe,2024-04-26 15:56:00
Apr-26-24,02:56PM,Is Amazon Stock A Buy With Q1 Report Ahead?,2024-04-26 14:56:00
Apr-26-24,02:19PM,3 Robotics Stocks That Will Make Early Investors Exceedingly Wealthy,2024-04-26 14:19:00
Apr-26-24,01:49PM,Amazon Faces Lawsuit From UK Union on Alleged Pressure to Leave Labor Group,2024-04-26 13:49:00
Apr-26-24,01:30PM,Amazon Plans Further Drone ExpansionBut Will Shutter Calif. Prime Air Site,2024-04-26 13:30:00
Apr-26-24,01:22PM,20 States With the Most Beautiful Flags According to Reddit,2024-04-26 13:22:00
Apr-26-24,12:36PM,The Top 3 Stocks to Buy in April 2024,2024-04-26 12:36:00
Apr-26-24,11:29AM,Trump Media Stock's Wild Ride: Should You Jump on Board or Steer Clear?,2024-04-26 11:29:00
Apr-26-24,11:23AM,Will Solid AWS Momentum Aid Amazon's (AMZN) Q1 Earnings?,2024-04-26 11:23:00
Apr-26-24,10:49AM,"Sellers Lurk In Amazon Stock, Super Micro Computer Ahead Of Earnings",2024-04-26 10:49:00
Apr-26-24,10:43AM,Diversification Dynamos: 3 ETFs to Instantly Fortify Your Portfolio,2024-04-26 10:43:00
Apr-26-24,10:30AM,"Amazons Bezos, Jassy Deleted Chats Amid FTC Antitrust Probe",2024-04-26 10:30:00
Apr-26-24,10:17AM,Walmart history: Beyond the Ticker,2024-04-26 10:17:00
Apr-26-24,10:07AM,Why Amazon (AMZN) Might Surprise This Earnings Season,2024-04-26 10:07:00
Apr-26-24,09:45AM,Microsoft beats Q3 top and bottom lines on cloud strength,2024-04-26 09:45:00
Apr-26-24,09:15AM,"Dividend Watch: Your Move, Amazon",2024-04-26 09:15:00
Apr-26-24,09:14AM,Helen of Troy Limited (NASDAQ:HELE) Q4 2024 Earnings Call Transcript,2024-04-26 09:14:00
Apr-26-24,09:00AM,3 Reasons to Buy Swimwear at Costco,2024-04-26 09:00:00
Apr-26-24,08:00AM,How This Simple Indicator Revealed True Strength In Amazon Stock,2024-04-26 08:00:00
Apr-26-24,08:00AM,Ditch Dividend Funds for These 3 High-Quality ETFs,2024-04-26 08:00:00
Apr-26-24,07:15AM,1 Unstoppable Artificial Intelligence (AI) Stock to Buy and Hold Forever,2024-04-26 07:15:00
Apr-26-24,06:30AM,This Stock Has Billionaire Buy-in. Time to Add It to Your Portfolio?,2024-04-26 06:30:00
Apr-26-24,05:47AM,"Billionaire Ken Griffin Owns All the ""Magnificent Seven"" Stocks. These 3 Are His Favorites.",2024-04-26 05:47:00
Apr-26-24,05:26AM,"Alphabet stock surges on earnings beat, dividend announcement",2024-04-26 05:26:00
Apr-26-24,05:00AM,"Meta's AI annoys, Microsoft and Amazon under scrutiny, banks go all-in: AI news roundup",2024-04-26 05:00:00
Apr-26-24,04:09AM,1 Wall Street Analyst Thinks Amazon Stock Is Going to $235. Is It a Buy at Around $180?,2024-04-26 04:09:00
Apr-26-24,04:00AM,"1 Unstoppable Stock That Could Join Microsoft, Apple, Nvidia, Alphabet, Amazon, and Meta in the $1 Trillion Club",2024-04-26 04:00:00
Apr-25-24,09:08PM,"Amazon should be forced to disclose how Jeff Bezos and others were instructed to use the Signal disappearing-message app, FTC says",2024-04-25 21:08:00
Apr-25-24,06:11PM,10 Best Streaming Service Stocks To Buy,2024-04-25 18:11:00
Apr-25-24,06:07PM,10 Best E-Commerce Stocks To Buy According to Analysts,2024-04-25 18:07:00
Apr-25-24,05:39PM,Microsoft-Backed Rubrik Surges More Than 15% in Its Trading Debut,2024-04-25 17:39:00
Apr-25-24,04:00PM,Even Nvidia Can't Pull Off This Feat. Only One AI Stock Has.,2024-04-25 16:00:00
Apr-25-24,03:30PM,AI Costs in Focus Ahead of Tech Earnings After Meta's Q1 Debacle,2024-04-25 15:30:00
Apr-25-24,03:04PM,Amazon plans $11 billion investment in Indiana data centers,2024-04-25 15:04:00
Apr-25-24,02:10PM,"Why Microsoft, Amazon, Alphabet, and Other ""Magnificent Seven"" Stocks Crashed on Thursday",2024-04-25 14:10:00
Apr-25-24,02:02PM,Jeff Bezos Has Been Predicting Amazon's 'Inevitable Death' For Years And Says Lifespans Of Large Companies 'Tend To Be 30-Plus Years' Not 100,2024-04-25 14:02:00
Apr-25-24,01:54PM,"Hasbro, Inc. (NASDAQ:HAS) Q1 2024 Earnings Call Transcript",2024-04-25 13:54:00
Apr-25-24,01:47PM,Heard on the Street: Meta Isn't Losing Friends on Wall Street This Time,2024-04-25 13:47:00
Apr-25-24,01:43PM,What You Need To Know Ahead of Amazon's Earnings Report Tuesday,2024-04-25 13:43:00
Apr-25-24,01:40PM,"NBA TV Rights Talks Heat Up, With Amazon, YouTube Vying to Air Games",2024-04-25 13:40:00
Apr-25-24,01:40PM,"Amazon, YouTube Vie for NBA Streaming Rights as Leagues Media Talks Heat Up",2024-04-25 13:40:00
Apr-25-24,12:45PM,Amazon Prime Video to exclusively stream two NHL seasons in Canada,2024-04-25 12:45:00
Apr-25-24,12:42PM,Update: Market Chatter: Amazon.com Ordered to Comply with Labor Department Subpoena for Anti-Union Travel Costs,2024-04-25 12:42:00
Apr-25-24,11:56AM,Is Amazon (AMZN) Stock Worth Buying Ahead of Q1 Earnings?,2024-04-25 11:56:00
Apr-25-24,11:30AM,Amazon Fined $10.7 Million by Italian Antitrust Authority Over Subscribe and Save,2024-04-25 11:30:00
Apr-25-24,11:23AM,Prime Video to Stream Monday Night NHL Games in Canada From 2024-25 Season,2024-04-25 11:23:00
Apr-25-24,11:10AM,15 Most Affordable Grocery Stores In the US,2024-04-25 11:10:00
Apr-25-24,11:00AM,"Prime Video to Become the Home of National Monday Night NHL Games in Canada Beginning in 2024-25 Season, with Prime Monday Night Hockey",2024-04-25 11:00:00
Apr-25-24,10:57AM,Amazon announces $11bn data centre investment in US state of Indiana,2024-04-25 10:57:00
Apr-25-24,10:57AM,Silicon Laboratories Inc. (NASDAQ:SLAB) Q1 2024 Earnings Call Transcript,2024-04-25 10:57:00
Apr-25-24,10:45AM,"UBS Raises Amazon's Price Target to $215 From $198, Maintains Buy Rating",2024-04-25 10:45:00
Apr-25-24,10:45AM,Market Chatter: Amazon.com Ordered to Comply with US Labor Department Subpoena for Anti-Union Travel Costs,2024-04-25 10:45:00
Apr-25-24,10:41AM,"Amazon.com's AWS Unit to Invest $11 Billion in Data Centers, Other Projects in Indiana",2024-04-25 10:41:00
Apr-25-24,10:32AM,"The Interpublic Group of Companies, Inc. (NYSE:IPG) Q1 2024 Earnings Call Transcript",2024-04-25 10:32:00
Apr-25-24,10:20AM,"Alphabet earnings preview: All eyes on AI investments, ad market growth as Meta disappoints",2024-04-25 10:20:00
Apr-25-24,10:14AM,Amazon Web Services to Build Data Center in Northern Indiana,2024-04-25 10:14:00
Apr-25-24,10:10AM,Walgreens launches specialty pharmacy unit to compete in new PBM era,2024-04-25 10:10:00
Apr-25-24,09:54AM,8 Powerful Alternatives to Elasticsearch,2024-04-25 09:54:00
Apr-25-24,09:25AM,Amazon cloud computing unit plans to invest $11 billion to build data center in northern Indiana,2024-04-25 09:25:00
Apr-25-24,09:15AM,"Exploring Analyst Estimates for Amazon (AMZN) Q1 Earnings, Beyond Revenue and EPS",2024-04-25 09:15:00
Apr-25-24,08:30AM,"3 Things You Might Not Know About This ""Magnificent Seven"" Stock",2024-04-25 08:30:00
Apr-25-24,08:20AM,"Artificial Intelligence (AI) Robots Are a $38 Billion Market, According to Goldman Sachs. Here's How the ""Magnificent Seven"" Are Investing in the Technology.",2024-04-25 08:20:00
Apr-25-24,08:11AM,Amazon to invest $11 billion in Indiana to build data centers,2024-04-25 08:11:00
Apr-25-24,07:00AM,Gov. Holcomb announces Amazon Web Services plans to invest $11B to create a new data center campus in Northern Indiana,2024-04-25 07:00:00
Apr-25-24,05:50AM,These 3 Dow Stocks Are Set to Soar in 2024 and Beyond,2024-04-25 05:50:00
Apr-25-24,05:45AM,"If You Invested $10,000 in Amazon 10 Years Ago, This Is How Much You Would Have Today",2024-04-25 05:45:00
Apr-25-24,12:08AM,RPT-Ambani's JioCinema cuts subscription prices as India's streaming war heats up,2024-04-25 00:08:00
Apr-24-24,08:05PM,Analysts reboot Amazon stock price target ahead of earnings,2024-04-24 20:05:00
Apr-24-24,05:53PM,Court revives Whole Foods worker's lawsuit over 'Black Lives Matter' masks,2024-04-24 17:53:00
Apr-24-24,05:27PM,Is Amazon Stock Going to $230? 1 Wall Street Analyst Thinks So.,2024-04-24 17:27:00
Apr-24-24,04:55PM,Meta Stock Plunges On Weak Guidance Despite Earnings Beat,2024-04-24 16:55:00
Apr-24-24,04:49PM,"China's Temu Takes Over 17% Of US Market Share, Cutting Jobs From American Amazon And Decimating Small Businesses",2024-04-24 16:49:00
Apr-24-24,04:27PM,UK Regulators Are Looking Into Amazon and Microsoft AI Partnerships Here's Why,2024-04-24 16:27:00
Apr-24-24,03:44PM,Microsoft and Amazon's AI deals are getting antitrust scrutiny in the U.K.,2024-04-24 15:44:00
Apr-24-24,03:30PM,Ambani's JioCinema cuts subscription prices as India's streaming war heats up,2024-04-24 15:30:00
Apr-24-24,03:09PM,Hawaiian Airlines slowly adds freighters for Amazon business,2024-04-24 15:09:00
Apr-24-24,01:11PM,Market Chatter: Amazon.com Unveils Custom AI Capabilities,2024-04-24 13:11:00
Apr-24-24,12:40PM,Amazon Introduces Custom AI Capabilities in Race Against Cloud Rivals,2024-04-24 12:40:00
Apr-24-24,12:16PM,12 Best Growth Stocks to Buy and Hold in 2024,2024-04-24 12:16:00
Apr-24-24,11:54AM,Amazon rolls out unlimited grocery delivery subscription with Prime,2024-04-24 11:54:00
Apr-24-24,11:04AM,Amazon.com Fined by Italian Antitrust Regulator for 'Unfair' Commercial Practices,2024-04-24 11:04:00
Apr-24-24,10:48AM,Elon Musk's Big Bet: Tesla to Ramp Up AI Development with Nvidia's Powerful Chips,2024-04-24 10:48:00
Apr-24-24,10:44AM,Amazon to Open More Cloud Centers in Southeast Asia for Better Data Protection,2024-04-24 10:44:00
Apr-24-24,10:38AM,Research Reveals Mobile Devices as Catalysts for Efficient Decentralized Infrastructure Networks (DePINs),2024-04-24 10:38:00
Apr-24-24,09:46AM,"Hawaiian Holdings, Inc. (NASDAQ:HA) Q1 2024 Earnings Call Transcript",2024-04-24 09:46:00
Apr-24-24,09:35AM,Latest Insider Trading Activity: 11 Stocks Executives and Directors are Buying,2024-04-24 09:35:00
Apr-24-24,08:03AM,Microsoft's AI lead puts Amazon cloud dominance on watch,2024-04-24 08:03:00
Apr-24-24,07:30AM,Nextech3D.ai Selects AWS as its Primary Cloud Provider to Drive Innovation in the 3D Modeling For Ecommerce Industry With Cutting Edge AI,2024-04-24 07:30:00
Apr-24-24,07:29AM,"UK Regulators Taking Closer Look at Amazon, Microsoft AI Deals",2024-04-24 07:29:00
Apr-24-24,07:15AM,"Buy, Sell, or Hold: Amazon",2024-04-24 07:15:00
Apr-24-24,06:10AM,These Are the 10 High-Profile Stocks U.S. Politicians Have Gravitated to Most Over the Last 3 Years,2024-04-24 06:10:00
Apr-24-24,05:35AM,UPDATE 1-Italy fines Amazon 10 mln euros for alleged unfair commercial practices,2024-04-24 05:35:00
Apr-24-24,05:06AM,"Meet the 3 ""Magnificent Seven"" Stocks Members of Congress Can't Stop Selling",2024-04-24 05:06:00
Apr-24-24,04:12AM,History Says the Nasdaq Could Soar: 2 Top Growth Stocks to Buy Now and Hold for the Bull Market,2024-04-24 04:12:00
Apr-24-24,04:01AM,13 Best Ethical Companies to Invest in 2024,2024-04-24 04:01:00
