headline,neg,neu,pos,compound
Screenshots suggest TikTok is circumventing Apple App Store commissions,0.0,1.0,0.0,0.0
"Wall Street expecting a 4-5% revenue decline from Apple, says Third Bridge's Scott Kessler",0.0,1.0,0.0,0.0
"Googles Payments to Apple Reached $20 Billion in 2022, Antitrust Court Documents Show",0.0,0.896,0.104,0.1027
"Apple, Novo Nordisk earnings, jobless claims: What to watch",0.0,1.0,0.0,0.0
How Anthropic's New Claude iOS App and Enterprise Plan Could Help Amazon in AI Race,0.0,0.747,0.253,0.5267
"Hanna Andersson adds Apple, Gap veteran to c-suite",0.0,1.0,0.0,0.0
"Apple Q2 earnings: Services, gen. AI are potential bright spots",0.0,0.756,0.244,0.4404
12 Most Hated Countries in Europe,0.473,0.527,0.0,-0.6697
"Apple to report Q2 earnings amid iPhone slowdown, China troubles",0.25,0.75,0.0,-0.4588
Wedbush Just Raised Its Price Target on These 3 Stocks,0.0,1.0,0.0,0.0
Magnificent Seven Stocks: Nvidia Stock Dives Below Key Level; Amazon Rallies On Earnings,0.0,0.663,0.337,0.6808
Analyst Upgrades: 3 Stocks That the Pros Can't Stop Raving About,0.0,0.827,0.173,0.2235
Shhh! 3 Secret Stocks Flying Below Wall Street's Radar,0.0,1.0,0.0,0.0
"After Nvidia and Apple, Alibaba Chases Vietnam: New Data Center to Boost Control and Meet Local Laws",0.0,0.856,0.144,0.4019
Trade Tracker: Joe sells Apple and Tesla in the JOET rebalance,0.0,1.0,0.0,0.0
Exxon Mobil Corporation (NYSE:XOM) Q1 2024 Earnings Call Transcript,0.0,1.0,0.0,0.0
Will Solid Mac Sales & Services Aid Apple's (AAPL) Q2 Earnings?,0.0,0.849,0.151,0.1531
"Meet the Unstoppable Stock That Just Joined Nvidia, Microsoft, and Apple in the $2 Trillion Club",0.107,0.893,0.0,-0.2023
Is a Surprise Coming for Apple (AAPL) This Earnings Season?,0.0,0.792,0.208,0.2732
Top 20 Tech Companies in Silicon Valley,0.0,0.769,0.231,0.2023
What You Need To Know Ahead of Apple's Earnings Report,0.0,1.0,0.0,0.0
"Setting the Stage for Apple's 2Q24 Earnings, Thoughts on Apple's Stock Price Underperformance",0.0,1.0,0.0,0.0
Berkshire Hathaways Earnings Come Soon. 5 Points to Watch Beyond the Profit.,0.0,0.775,0.225,0.4404
What You Need To Know Ahead of Warren Buffett's Berkshire Hathaway Annual Meeting,0.0,1.0,0.0,0.0
3 Spatial Computing Stocks That Will Dominate the Future of Work,0.143,0.857,0.0,-0.128
3 Top Penny Stocks to Buy for Explosive Returns: April Edition,0.0,0.833,0.167,0.2023
Apple set for big sales decline as investors await AI in iPhones,0.0,0.887,0.113,0.1027
"Apples promised AI plan is all that matters, analysts say, as it tries to play catch up with Big Tech rivals",0.0,0.75,0.25,0.6124
Will Apple Be a Trillion-Dollar Stock by 2035?,0.0,1.0,0.0,0.0
3 ETFs to Buy When the Market Gets Crazy,0.255,0.745,0.0,-0.34
Apple earnings might surprise Wall Street despite an iPhone sales slump. Here's why,0.0,0.851,0.149,0.2732
Is Apple Stock Going to $195? 1 Wall Street Analyst Thinks So.,0.0,1.0,0.0,0.0
Berkshire Hathaways Results Are Saturday. 5 Points to Watch Beyond the Profit.,0.0,0.775,0.225,0.4404
"In Ominous Sign for Apple, Skyworks Warns About Soft Mobile Phone Demand",0.371,0.629,0.0,-0.5106
Apple's new Beats headphones are here and they're a lot cheaper than AirPods,0.0,1.0,0.0,0.0
Skyworks forecasts third-quarter revenue below estimates,0.0,1.0,0.0,0.0
April was a losing month for tech stocks. Here's why,0.245,0.755,0.0,-0.3818
Google and Apple now threatened by the US antitrust laws helped build their technology empires,0.176,0.824,0.0,-0.4588
"Apple's Glass Supplier Corning Outperforms in Tough Market, Eyes $3B Sales Boost in Three Years",0.087,0.756,0.157,0.296
Apple's Safari browser got a new AI makeover   and it may even let you escape ads,0.0,0.892,0.108,0.1779
Shhh! 3 Secret Augmented Reality Stocks Flying Below Wall Street's Radar,0.0,1.0,0.0,0.0
Magnificent Seven Stocks Largely Dip Before Amazon Earnings Release,0.0,0.556,0.444,0.6808
"Apple's Secret AI Lab in Zurich Poised to Enhance iPhone Capabilities, Poach Google Staff",0.0,0.867,0.133,0.25
"Apple Likely to Meet Q2 Guidance, But Q3 Outlook to Miss Consensus, Oppenheimer Says",0.128,0.872,0.0,-0.2263
ResMed Inc. (NYSE:RMD) Q3 2024 Earnings Call Transcript,0.0,1.0,0.0,0.0
Comcast Corporation (NASDAQ:CMCSA) Q1 2024 Earnings Call Transcript,0.0,1.0,0.0,0.0
Sanctions can't stop Huawei from soaring past Apple in China,0.0,0.827,0.173,0.2235
PG&E Corporation (NYSE:PCG) Q1 2024 Earnings Call Transcript,0.0,1.0,0.0,0.0
25 Richest Billionaires in Sports Industry,0.0,0.595,0.405,0.5267
Apple is poaching dozens of AI experts from Google and building a secret AI lab,0.0,1.0,0.0,0.0
Apple's China demand woes are 'overblown': Strategist,0.468,0.532,0.0,-0.5267
iPhone 16 may come in new color-infused green,0.0,1.0,0.0,0.0
"Alphabet 1Q24 Earnings, Pichai (Sort Of) Hints at Apple / Gemini Rumors, Google Announces HW Reorganization",0.0,1.0,0.0,0.0
Huawei steals market share from Apple despite Western sanctions,0.264,0.56,0.176,-0.2732
Stocks Fall as Hot Pay Data Fuel Hawkish Fed Bets: Markets Wrap,0.113,0.887,0.0,-0.1027
"WisdomTree, Inc. (NYSE:WT) Q1 2024 Earnings Call Transcript",0.0,1.0,0.0,0.0
RPT-Amazon.com may be feeling pressure to join the dividend club,0.171,0.543,0.287,0.128
Jim Cramer is Recommending These 10 Stocks Heading Into May 2024,0.0,1.0,0.0,0.0
3 Autonomous Driving Stocks with the Potential to Make You an Overnight Millionaire,0.0,1.0,0.0,0.0
3 AI Stocks That Could Make You a Fortune (If You Dare),0.0,1.0,0.0,0.0
Why Apple Stock Can Bounce Back Higher in 2024,0.0,1.0,0.0,0.0
Amazon.com may be feeling pressure to join the dividend club,0.171,0.543,0.287,0.128
Huawei Profit Surges 564% As It Eclipses Apple in China,0.0,0.756,0.244,0.4404
"With iPhone sales weak, Chinese/South Korean smartphone and OLED manufacturers take advantage to increase capacity",0.151,0.625,0.224,0.1027
"5 of the ""Magnificent Seven"" Stocks Pay a Dividend. In Mere Hours, a New Member May Join the Club",0.068,0.634,0.298,0.6908
Samsung teams up with Intel to launch first AI AIO PC to expand ecosystem,0.0,0.85,0.15,0.3182
Jim Cramer looks at Apple and Tesla's stock flips,0.0,1.0,0.0,0.0
5 Largest Software Companies in the World by Market Cap,0.0,1.0,0.0,0.0
"Despite complaints, Apple hasn't yet removed an obviously fake app pretending to be RockAuto",0.175,0.619,0.206,-0.1134
"Tesla bounces back, SoFi down on Q2 forecast: Market check",0.0,1.0,0.0,0.0
Apple earnings: iPhone sales fuel 'relatively flat' expectations,0.0,1.0,0.0,0.0
Republican Congress Members and Insiders are Buying These 10 Stocks,0.0,1.0,0.0,0.0
"These Stocks Moved the Most Today: Tesla, SoFi, Alphabet, Apple, Paramount, AMC, Fulton Financial, Deciphera, and More",0.0,1.0,0.0,0.0
Apple iPad event 2024: Watch Apple unveil new iPads right here,0.0,1.0,0.0,0.0
US STOCKS-Wall Street stocks finish higher as investors focus on Fed moves,0.0,1.0,0.0,0.0
"Apple Stock Out Of Favor, Hopes For Earnings Report Lift",0.0,0.593,0.407,0.6705
Nvidia's Woes Are Your Windfall: 3 AI Stocks to Grab Now,0.244,0.756,0.0,-0.4404
The Dow takes a break as earnings season ramps up,0.0,1.0,0.0,0.0
15 Fastest Growing Cities in California,0.0,0.746,0.254,0.1779
Apple shares rise after Bernstein analyst takes bullish stance,0.0,0.784,0.216,0.296
US STOCKS-Wall Street stocks gain as investors focus on Fed moves,0.0,0.746,0.254,0.5267
"These Stocks Are Moving the Most Today: Tesla, SoFi, Alphabet, Apple, Paramount, AMC, Fulton Financial, Deciphera, and More",0.0,1.0,0.0,0.0
"Tesla's Chinese rival Xiaomi has already built 10,000 SU7 electric sedans",0.0,1.0,0.0,0.0
How Short Sellers Look Through the Muddy Waters of Filings for Fraud,0.257,0.743,0.0,-0.5859
Apple and Amazon set to report earnings this week. Here's what to expect,0.0,0.876,0.124,0.1779
Sector Update: Tech Stocks Gain Monday Afternoon,0.0,0.638,0.362,0.5267
"Tesla, Apple Help US Equity Indexes Extend Gains",0.0,0.424,0.576,0.7003
Sector Update: Tech,0.0,1.0,0.0,0.0
What Would Happen If Warren Buffett Bailed On Apple And Sold All Of Berkshire Hathaway's Shares?,0.0,0.872,0.128,0.296
Call of the Day: Apple,0.0,1.0,0.0,0.0
Apple: Here's why Bernstein upgraded the stock,0.0,1.0,0.0,0.0
What's Giving Apple's Stock a Boost on Monday?,0.0,0.495,0.505,0.6249
"Top Stock Movers Now: Tesla, Apple, Google Parent Alphabet, and More",0.0,0.847,0.153,0.2023
China is directly shaping Apple and Tesla. Here's how.,0.0,1.0,0.0,0.0
Apple's iPadOS will have to comply with EU's Digital Markets Act too,0.0,1.0,0.0,0.0
Should You Buy Apple (AAPL) Stock Ahead of Q2 Earnings?,0.0,1.0,0.0,0.0
US Benchmark Equity Indexes Extend Gains in Midday Trading,0.0,0.631,0.369,0.4767
"Apple Stock Jumps Ahead of Earnings. Its Slump Is a Buying Opportunity, Analyst Says.",0.0,0.811,0.189,0.4215
US STOCKS-Wall St edges up as Tesla and Apple gain; Fed decision awaited,0.071,0.71,0.219,0.5106
Apple earnings preview: AI investment and iPhone sales,0.0,1.0,0.0,0.0
